,content
2226,baltimore brace chaos mistrial declared freddie gray casethe juror freddie gray case deadlocked judge asked continue deliberating end just couldn t come verdict didn t long protest break courthouse ready chaos baltimore baltimore rnn judge declared mistrial case officer charged connection death freddie gray jury failed reach verdict following deliberation course daysfreddie gray juror deadlocked judge say deliberating william porter baltimore police officer trial charged manslaughter seconddegree assault reckless endangerment misconduct office gray injured taken police custody later dieda day mistrial judge ordered jury continue deliberating reported reached verdict jury sent note judge deadlocked deliberation began mondaydemonstrations broke downtown minute announcement verdict law enforcement officer tried disperse crowd blocking traffictessa hillaston president baltimore chapter naacp expected citywide protest wednesday night respect police case freddie dead didn t way hillaston said officer porter admitted freddie asked help didn t him end day asks medical help didn t it maybe freddie alive gray suffered neck spinal cord injury van april 12 resulted death week later falling comathe van stop gray inside porter admitted testimony week did immediately medic gray initially asked help fourth stopprosecutors argued porter ignored gray s plea medical help porter driving police transport van went department policy securing gray properly vehiclebaltimore city attorney marilyn mosby said gray died handcuffed shackled unrestrained ruled death homicide charged officer 1prosecutors decide try porter again officer charged scheduled separate trialsvia kmov
2327,kidding pa college cancel play author object use white actorsjust suppose play cancelled school using black actor place storya small state college northern pennsylvania canceled musical week scheduled open playwright objected use white actor south asian charactersclarion university spent year preparing stage punk rock version jesus india dramatist lloyd suh ran offbroadway 2013 received favorable reviewssuh owns right musical sent email monday school s play director marilouise michel ordering replace nonasian actor ethnically appropriate actor cancel production open nov 18 severe objection use caucasian actor role clearly written south asian actor consider absolutely unacceptable distortion play suh wrote email provided reuters michelmichel told reuters thursday indian role played biracial girl rest white doing role brownface using dialect said suh rejected solution removing themsuh play exotic oriental murder mystery running offbroadway month did respond request comment did agent beth blickersmichel said clarion university 4900 student student body 06 percent asian asian auditioned playshe tried time reach suh phone discus aspect play did call canceled tuesday saidwhen saw cast photo earlier month demanded blickers know ethnicity actor said couldn t stop cry saw photo realized happening suh wrote emailon tuesday day suh s email new york time published opinion piece indianamerican comedian aziz ansari decrying treatment asian particularly indian actor medium noted actor harder findvia reuters
2333,mother terrorist wearing suicide vest did mean kill anyone stressedamerican translation baby didn t nothin wrong good boy loved everyone mind brother wanted man world pretty strapped suicide vest stressful day right like nice family ibrahim abdeslam 31 detonated suicide vest outside cafe comptoir voltaire close scene deadly bataclan concert theatre hall atrocity friday nighthe did kill himselfhis brother mohamed council worker arrested brussels saturday sibling salah world s wanted men subject international man huntabdeslam salah currently wanted man worldbut today abdeslam family defended sick action said surprised blew up spent time wartorn syriahis mother suggested suicide jacket gone accident said carried attack stressed speaking outside family home molenebeek told reporter sure planned kill anyoneshe said plan s sure fact suicide belt exploded killing say lot saw day attack sign plan violentbut family did admit ibrahim spent long time syriathey added really surprised salah involved ibrahim different did radicalised part thought commit atrocity like this family member said wanted suicide bomber explosive went prematurely accident stress addedibrahim seriously injured innocent bystander blew up rented seat leon used attacksthe car used terrorist murdered diner outside casa nostra pizza restaurant la belle equipe cafeit later abandoned 20 minute away montreal cache weapon inside
2408,sweden house 600 muslim refugee luxury ski resortrefugees complain it terrible just wind snow road slipperynothing best soldier caliphate invading socialdemocratic led country sweden 600 asylum seeker set world s northerly ski resort sweden struggle temporary accommodation record number new arrivalsriksgr nsen sits 200 kilometre arctic circle close sweden s border norway set welcome refugee following deal resort s owner swedish migration agency migrationsverket know refugee crisis world asylum seeker arriving sweden migrationsverket major urgent need temporary housing accommodate need help lapland resort ab pleased able help sven kuldkepp ceo lapland resort told swedish newspaper norrbottenskuriren email wednesday leave cold quite warm added separate commentkuldepp explained refugee allowed stay riksgr nsen february 2016 main tourist ski season wayhe said plan affect ordinary activity added hoped resort able create job asylum seekersthe come amid push sweden s social democratled government encourage municipality sweden refugeesat moment vast majority asylum seeker end stockholm gothenburg malm but northern sweden common base asylum seeker friday group 19 eritrean landed lule taken stersund phase programme relocate ten thousand refugee euhowever campaigner raised concern people raised africa middle east adapting dark freezing condition regionin january group refugee taken housing centre near stersund initially refused bus claiming told official living close stockholm instead finding driven 15 hour north coming area middle forest know about just snow wind else esam taha 36 syria told local week reflecting chaos terrible just wind snow road slippery moment got bus slipped fell down explainedbut asylum seeker say expects settle area argues refugee tricky adapt frozen northmore refugee sought asylum sweden far 2015 year nordic nation s history new figure released country s migration agency revealed monday86223 people launched case surpassing previous record set 1992 84016 people sought asylum following fighting balkansvia local se
2455,stupid hurt video nyc jogger threatens dad stroller bumping himaccuses white privilegetheres problemthis jogger perfect example indoctrinated youth grow well just stupid people don t let happen child involved education ask question discussion having school blame child grows stupid
2627,republican proposes house force supreme court justice employee join obamacareof course d okay excluding justice didn t rubber stamping obama s reckless socialized medicine plan it s fair barry family forced use signature obamacare insurance plan house republican thursday proposed forcing supreme court justice staff enroll obamacarerep brian babin rtexas said scotuscare act make justice employee join national healthcare law s exchange supreme court continues ignore letter law s important individual understand impact decision american people said s introduced scotuscare act require supreme court employee sign obamacare babin saidbabin s potential legislation let federal government provide healthcare supreme court staff obamacare exchange eliminating exemption obamacare firsthand american people forced live with addedhis follows supreme court s ruling thursday morning upheld subsidy obamacare provided government offset cost buying insurancethe 63 decision authored chief justice john robert said consumer purchasing health insurance federal exchange roughly 34 state continue sothe ruling king v burwell spurred anger right conservative questioning logic decision deserve olympic medal legal gymnastics rep joe pitt rpa chairman house energy commerce health subcommittee told hillroberts argued decision eliminating subsidy pulled state healthcare market death spiral chain effect added consistent obamacare s intent argument phrase established state superfluous congress meant extend tax credit state federal exchange unpersuasive wrotejustice antonin scalia strongly criticized interpretation dissent start calling law scotuscare wrote lambasting robert obamacare decision 2012 declaring law s mandate people buy insurance constitutionalvia hill
2792,controversy christian flag engulfs small townlocal resident supported flag national group said received complaint flag good case separation church state debate awaya month north georgia county caught hell raising confederate battle flag courthouse flag controversy engulfed small middle georgia townonly time civil wara traditional christian flag flying cochran come friday city official bowed week threat legal action concern impact city s fiscal resource controversy began early month cochran city council voted advice attorney fly flag city hall help promote local biblereading marathon sponsored international bible reading associationwhile city official said local resident supported decision national group including dcbased american united separation church state said received complaint matter group recently sent letter city bleckley county flown flag past declaring flying christian flag public property violates amendmentthe group cited recent legal case north carolina city agreed stop displaying christian flag includes latin cross governmentsponsored veteran memorialin statement website city said decided flag reviewing input community detailed written legal opinion city attorney second legal opinion constitutional lawyer future city said fly u state flag city hallvia ajc
2889,mother year drives11 armed 15 yr old son 4 teenage friend fighta 14yearold boy suffered gunshot wound leg wednesday april 8 woman drove juvenile residence kenner continue fight occurred earlier day authority saidpolice arrested woman lakenya hall 35 kenner instigated fight taking group boy included 11 15yearold son said lt brian mcgregor spokesman kenner police departmentthe injured teen taken nearby ochsner medical center kenner expected recoverthe shooting occurred just 5 pm wednesday 3500 block west louisiana state drive kenner police learned teen involved earlier fight bus stop mcgregor said authority aren t sure teen fighting aboutafterwards hall 225 clemson place drove juvenile mile half away lincoln manor neighborhood west louisiana state drive continue brawl mcgregor saidat point 15yearold boy confronted hall s group pulled 22caliber pistol stored backpack began chasing them mcgregor said opened fire hitting 14yearold boypolice arrested 15yearold boy booked aggravated battery illegal possession handgun juvenile possession firearm obliterated serial number illegal use weapon disturbing peace fighting mcgregor saidofficers arrested hall booked disturbing peace fighting count contributing delinquency juvenile just ve fight doesn t right start new fight mcgregor said s instigating taking group place police arrested hall s son booked disturbing peace fighting investigator expect arrest come identify teen present time fight shooting mcgregor saidauthorities told video exists fight police working it going juvenile engaging fight city kenner mcgregor said
2931,trump accelerating decline global influenceit said current administration merely finishing job started consecutive twoterm president clinton george w bush barack obama bear mind trump end year officethis new year let forget reignited middle east crisis consecutive sacking libya syria moderate rebel terrorist syria certainly miss barack generous them patrick henningsen 21wire december 29 2017while make america great political campaign jour home year likely coincide overall decline influence worldmehr news report past decade world warii disintegration soviet union end cold war world dominated term politics military economy rising new world power end 20th century beginning 21st century challenged global domination washington s challenge new multipolar world order recent year resulted decline influence world expected accelerated withtrump s term white houserecognizing alquds jerusalem israeli regime s capital trump created lot negative reaction resulted resolution general assembly despite threat clear example declining global influencedecline domination world trade financial regimesafter end world warii 1960 held 40 percent world economy rise new economic power like china japan eu 2013 just held 25 percent world economy considering recent decision trump withdraw tpp nafta tension eu decline expected near futurethe dollar dominated global financial trade banking regime beginning 21th century blow dollar global stand inflicted 1999 euro appeared official currency eu recent year rise chinese renminbi inflicted blow dollar global stand 2015 50 60 percent world trade transaction dollar according eu central bankduring past year sanction country like russia iran white house pressure country avoid transaction sanctioned country resulted agreement state business national currency instead dollar like agreement iran russia turkey china continuation agreement trend definitely lead decline dollar global stand futuredecline strategic importance term politics militarytrump s pressure nato important strategic achievement till member state pay cost alliance inflicted damage solidarity member state created doubt old european ally seriously formation european armyus inability solve south korea s missile nuclear program issue despite trump s rhetoric bluff inability materialize regional policy plan middle east change map region benefit strategic israel s close cooperation iran russia turkey iraq syria failure wrong policy forced old regional ally like turkey recalibrate relation cooperation white house region show limitation incapability resulting increasing decline washington s influencealso inability settle issue east ukraine crimea european ally expected blow strategic stand washington s european ally worse nowadays european consider measure east europe blackmailing gain energy market europeduring year office trump s move withdraw paris climate change accord tpp wrong approach nuclear deal iran jcpoa insatiable immigration policy resulted significant reduction number foreign student time finally partial recognition alquds israeli regime s capital inflicted blow global credibility influence country mended shorttermread trump news at 21st century wire trump filessupport 21wire subscribe member 21wiretv
2931,trump accelerating decline global influenceit said current administration merely finishing job started consecutive twoterm president clinton george w bush barack obama bear mind trump end year officethis new year let forget reignited middle east crisis consecutive sacking libya syria moderate rebel terrorist syria certainly miss barack generous them patrick henningsen 21wire december 29 2017while make america great political campaign jour home year likely coincide overall decline influence worldmehr news report past decade world warii disintegration soviet union end cold war world dominated term politics military economy rising new world power end 20th century beginning 21st century challenged global domination washington s challenge new multipolar world order recent year resulted decline influence world expected accelerated withtrump s term white houserecognizing alquds jerusalem israeli regime s capital trump created lot negative reaction resulted resolution general assembly despite threat clear example declining global influencedecline domination world trade financial regimesafter end world warii 1960 held 40 percent world economy rise new economic power like china japan eu 2013 just held 25 percent world economy considering recent decision trump withdraw tpp nafta tension eu decline expected near futurethe dollar dominated global financial trade banking regime beginning 21th century blow dollar global stand inflicted 1999 euro appeared official currency eu recent year rise chinese renminbi inflicted blow dollar global stand 2015 50 60 percent world trade transaction dollar according eu central bankduring past year sanction country like russia iran white house pressure country avoid transaction sanctioned country resulted agreement state business national currency instead dollar like agreement iran russia turkey china continuation agreement trend definitely lead decline dollar global stand futuredecline strategic importance term politics militarytrump s pressure nato important strategic achievement till member state pay cost alliance inflicted damage solidarity member state created doubt old european ally seriously formation european armyus inability solve south korea s missile nuclear program issue despite trump s rhetoric bluff inability materialize regional policy plan middle east change map region benefit strategic israel s close cooperation iran russia turkey iraq syria failure wrong policy forced old regional ally like turkey recalibrate relation cooperation white house region show limitation incapability resulting increasing decline washington s influencealso inability settle issue east ukraine crimea european ally expected blow strategic stand washington s european ally worse nowadays european consider measure east europe blackmailing gain energy market europeduring year office trump s move withdraw paris climate change accord tpp wrong approach nuclear deal iran jcpoa insatiable immigration policy resulted significant reduction number foreign student time finally partial recognition alquds israeli regime s capital inflicted blow global credibility influence country mended shorttermread trump news at 21st century wire trump filessupport 21wire subscribe member 21wiretv
