,content
3405,hillary clinton survives fbi pantomime 650000 email investigated 691000 second claire bernish free thought projectin surprise paying marginal attention fbi s clearing hillary clinton wrongdoing briefly reopened investigation however time took agency reach conclusion bereft logic reason constitutes hubristic insult public s intelligencein just 691000 second announcement conclusion fbi director james comey want believe agent thoroughly examined 650000 email newly discovered anthony weiner s computer including thread resulting attachment deciding clinton innocent wrongdoingwe people planet just stupid mildly amused farcical bullshit passed credible investigationindeed lightning pace putative second investigation boggles mind force uneasy question concerning true motivation apparent exceeding necessity ensure hillary clinton walk away scottfree amid rapidly mushrooming evidence flagrant corruption mendacious collusionjust cursory comparison investigation show marked difference impossible question legitimacy fbi s findingsin summer 2015 fbi commenced probe secretary state s use private email server tenure office john giacalone director national security branch met comey voice concern emanating intelligence community classified information possibly handled carelesslyfor nearly year 365 day 31536000 second sizable task force fbi agent pored enormous cache comprising 30000 email later totaling 44900 additional document originally handed clinton camp state department discoveredthis mean rounding rough estimate year bureau combed average just 123 document daywhile manageable slew investigator job basic comparison probe prof literal inanity reopened investigationlater day october 28 comey announced commencement secondary probe albeit consternation current official felt telling congress broke number investigatory guideline including possibly influencing outcome presidential raceaccording comey additional 650000 document located computer clinton aide huma abedin s nowdisgraced estranged husband anthony weiner deserved careful scrutiny pertinence relevance original investigation democratic nomineepublic official speculation predicted month yearslong investigation substantial manpower dedicated taskbut sunday november 6 shocker announcement fbi director comey inexplicably declared relevance clinton investigation new conclusion revealed secondary probethis mean rounding brevity day total length investigation fbi agent inspected 81250 document daygranted estimate averaged roughened comparison s sake contrast doesn t survive scantiest litmus test believabilitynot allbefore naysayer jump s comparison deflection consider following pointsalthough algorithm program combing document retrieve subject investigator keywords germane subject accordant people s name like way technological gatekeeper reveal subtle nuance displayed email published wikileaks hillary clinton campaign chair john podesta democratic national committeesuch fine gradation meaning naturally english language purposefully employed throw investigator interloper possibly revealed artificial mean quickly particularly currentlyavailable technologiesstill convincedconsider technology did exist discerning level scrutiny heightened overarching surveillance police state criminal roam freelaw enforcement department national security agency amassed astonishingly voluminous data set person country including email online activity technology advanced comb subtlety language hone criminal behavior activity incredible frequencyand nsa program revealed hunt keywords limit effectiveness terrorist plot halted progress intelligence discover hasn t solidified pointtechnology expert immediately weighed claiming technology doe exist frequently employed job perfectly mere day worriescontinue reading free thought projectsee also hillary s russian hack hoax biggest lie election seasonread election news at 21st century wire 2016 filessupport 21wire subscribe member 21wiretv
3433,revealed dark agenda globalization open bordersthe tina doctrine alternative brandon smith altmarketwhen people unfamiliar liberty movement stumble undeniable fact conspiracy globalism tend look easy answer understand exists people today conditioned perceive event misinterpreted standpoint occam s razor wrongly assume simplest explanation probably right onein fact occam s razor state instead summarize state simplest explanation given evidence hand probably right explanationit known documented decade push globalism deliberate focused effort select elite international financier central banker political leader numerous member exclusive think tank openly admit goal total globalization publication believing uneducated commoner read anyway carroll quigley mentor clinton member council foreign relation quoted open admission general scheme power financial capitalism a farreaching aim create world financial control private hand able dominate political country economy world whole controlled feudalist fashion central bank world acting concert secret agreement arrived frequent meeting conference apex system bank international settlement basel switzerland private bank owned controlled world s central bank private corporation central bank sought dominate government ability control treasury loan manipulate foreign exchange influence level economic activity country influence cooperative politician subsequent economic reward business world carroll quigley tragedy hopethe people effort enforce globalism tied particular ideology cultlike religion envision world order described plato s republic believe chosen fate destiny genetics rule philosopher king rest u believe wisest capable humanity offer evolutionary mean create chaos order air mold society willthis mentality evident system build exploit example central banking general mechanism driving nation debt currency devaluation ultimately enslavement widespread economic extortion end game central bank is believe triggering historic financial crisis used elite leverage promote complete global centralization viable solutionthis process destabilizing economy society directed head various central bank instead directed central global institution like international monetary fund bank international settlement outlined revealing mainstream article like ruling world money published harper magazinewe word globalists campaign new world order meant voluntary struggle drifting definitely world social democracy great delay disappointment efficient beneficent world system countless people hate new world order die protesting it attempt evaluate promise bear mind distress generation malcontent quite gallant gracefullooking people hg welles fabian socialist author new world order short house world order built f rom down look like great booming buzzing confusion use william james famous description reality end run national sovereignty eroding piece piece accomplish oldfashioned frontal assault richard gardner member trilateral commission published april 1974 issue foreign affair new world order happen u participation single significant component yes new world order force united state change perception henry kissinger world action council april 19 1994i quote globalists day long think general idea people globalism natural offshoot free market inevitable outcome economic progress reality simplest explanation given evidence hand globalism outright war waged ideal sovereign people nation guerrilla war fourth generation warfare waged small group elite rest usa significant element war concern nature border border nation state town village just line map invisible barrier dirt elite mainstream medium like believe instead border applied correctly represent principle least supposed functionhuman being natural community builder constantly seeking likemind likepurpose understand subconsciously group individual working often always accomplish more said human being natural tendency value individual freedom right voluntary association like forced associate people group hold similar valuescultures erect border because frankly people right vet wish join participate endeavor people right discriminate doe share core value or word right refuse association group ideology destructive continue story altmarketread nwo news at 21st century wire nwo file
3433,revealed dark agenda globalization open bordersthe tina doctrine alternative brandon smith altmarketwhen people unfamiliar liberty movement stumble undeniable fact conspiracy globalism tend look easy answer understand exists people today conditioned perceive event misinterpreted standpoint occam s razor wrongly assume simplest explanation probably right onein fact occam s razor state instead summarize state simplest explanation given evidence hand probably right explanationit known documented decade push globalism deliberate focused effort select elite international financier central banker political leader numerous member exclusive think tank openly admit goal total globalization publication believing uneducated commoner read anyway carroll quigley mentor clinton member council foreign relation quoted open admission general scheme power financial capitalism a farreaching aim create world financial control private hand able dominate political country economy world whole controlled feudalist fashion central bank world acting concert secret agreement arrived frequent meeting conference apex system bank international settlement basel switzerland private bank owned controlled world s central bank private corporation central bank sought dominate government ability control treasury loan manipulate foreign exchange influence level economic activity country influence cooperative politician subsequent economic reward business world carroll quigley tragedy hopethe people effort enforce globalism tied particular ideology cultlike religion envision world order described plato s republic believe chosen fate destiny genetics rule philosopher king rest u believe wisest capable humanity offer evolutionary mean create chaos order air mold society willthis mentality evident system build exploit example central banking general mechanism driving nation debt currency devaluation ultimately enslavement widespread economic extortion end game central bank is believe triggering historic financial crisis used elite leverage promote complete global centralization viable solutionthis process destabilizing economy society directed head various central bank instead directed central global institution like international monetary fund bank international settlement outlined revealing mainstream article like ruling world money published harper magazinewe word globalists campaign new world order meant voluntary struggle drifting definitely world social democracy great delay disappointment efficient beneficent world system countless people hate new world order die protesting it attempt evaluate promise bear mind distress generation malcontent quite gallant gracefullooking people hg welles fabian socialist author new world order short house world order built f rom down look like great booming buzzing confusion use william james famous description reality end run national sovereignty eroding piece piece accomplish oldfashioned frontal assault richard gardner member trilateral commission published april 1974 issue foreign affair new world order happen u participation single significant component yes new world order force united state change perception henry kissinger world action council april 19 1994i quote globalists day long think general idea people globalism natural offshoot free market inevitable outcome economic progress reality simplest explanation given evidence hand globalism outright war waged ideal sovereign people nation guerrilla war fourth generation warfare waged small group elite rest usa significant element war concern nature border border nation state town village just line map invisible barrier dirt elite mainstream medium like believe instead border applied correctly represent principle least supposed functionhuman being natural community builder constantly seeking likemind likepurpose understand subconsciously group individual working often always accomplish more said human being natural tendency value individual freedom right voluntary association like forced associate people group hold similar valuescultures erect border because frankly people right vet wish join participate endeavor people right discriminate doe share core value or word right refuse association group ideology destructive continue story altmarketread nwo news at 21st century wire nwo file
3476,syria peace council address united nation nyc photo henry lowendorf21st century wire say case ve missed it following video session featuring peace council recently returned factfinding mission syria including audience president bashar al assad discovered arrived surprised american visitor realized entire depiction narrative syria europe completely contrived patently false introduction he bashar ja afari permanent representative syrian arab republic peace council panel includesalfred marder president peace council mary compton member executive board peace council henry lowendorf member executive board peace council joe jamison member executive board peace council madelyn hoffman executive director new jersey peace action donna nassor professor lawyer peace councilwatch
3476,syria peace council address united nation nyc photo henry lowendorf21st century wire say case ve missed it following video session featuring peace council recently returned factfinding mission syria including audience president bashar al assad discovered arrived surprised american visitor realized entire depiction narrative syria europe completely contrived patently false introduction he bashar ja afari permanent representative syrian arab republic peace council panel includesalfred marder president peace council mary compton member executive board peace council henry lowendorf member executive board peace council joe jamison member executive board peace council madelyn hoffman executive director new jersey peace action donna nassor professor lawyer peace councilwatch
3479,shout poll white helmet qualify nobel peace prize 21st century wire asks currently western medium exists major public relation push raise profile supposed ngo syria known white helmet advance upcoming nobel peace prize award oct 7th oslo norway recently streaming giant netflix released documentary film fanfare alleged responder group syria called white helmet produce emotional image seen western medium syrian conflict claim saved 60000 life assad s bomb 2013 people aware of however group financed nato member state tune 60 million far embedded exclusively terroristheld area syria thing considered qualified nobel prizehave shout week vote comment engage useful reference linkswho syria s white helmetsthe real syria civil defence expose nato s white helmet terroristlinked imposterswhite helmet staged russian bombing scene near aleppo lappedup mediageorge soros antisyria campaign impresariointroduction smart power human right industrial complexhave shout vote current event
3479,shout poll white helmet qualify nobel peace prize 21st century wire asks currently western medium exists major public relation push raise profile supposed ngo syria known white helmet advance upcoming nobel peace prize award oct 7th oslo norway recently streaming giant netflix released documentary film fanfare alleged responder group syria called white helmet produce emotional image seen western medium syrian conflict claim saved 60000 life assad s bomb 2013 people aware of however group financed nato member state tune 60 million far embedded exclusively terroristheld area syria thing considered qualified nobel prizehave shout week vote comment engage useful reference linkswho syria s white helmetsthe real syria civil defence expose nato s white helmet terroristlinked imposterswhite helmet staged russian bombing scene near aleppo lappedup mediageorge soros antisyria campaign impresariointroduction smart power human right industrial complexhave shout vote current event
3484,russian military coalition predator drone spotted time place syria aid convoy attack21st century wire say despite proclamation official detail attack aid convoy yesterday sketchy evidence hand john kerry unnamed official claim know russian attacked aid convoy passing rebel terroristheld highway travelling west aleppo heading southwest alfoua kefraya village onset russian syrian military stated involved incident maintain guilty party john kerry blaming russia mysterious attack convoythe insistence blame russia attacking aid convoy appears desperate deflectanddivert public relation mask fact washington destroyed ceasefire agreement saturday massacred 70 syrian army soldier wounding 100 sustained hourlong attack involving multiple aircraft u uk australia denmark usled airstrike isi allowed advance immediately forward taking key strategic city deir alzour spite unlikely coincidence washington claimed just mistake addition coalition gulfbacked rebel terrorist broke russiaus ceasefire multiple time record boasting earlier week terroristheld east aleppo militant refuse aid convoy crossed sightsdid rebel force ground orchestrate false flag event designed avoid condemnation saturday s massacre western colleages putting best effort hype situation blur tragedy deir ezzor distract international community alnusra s advance aleppo cover incompetence distinguishing moderate opposition terrorist syria russian spokepersonnow new evidence suggests coalition misleading world true intention rtthe russian defense ministry say coalition drone vicinity humanitarian convoy attacked outside aleppo according russian military unmanned aircraft predator drone evening september 19 specific region drone belonging international condition taken incirlik air base turkey flying height 3600 meter traveling 200 kilometer hour said russian defense ministry spokesman igor konashenkov object area town urm alkubra convoy minute caught fire konashenkov added left 30 minute defense ministry spokesman said wanted point that case tragedy september 17 saw usled coalition airstrike kill injure 200 people russian making unfounded allegation owner know exactly drone doing particular area exact time addedmoscow say provided data posse regarding attack convoy carrying aid rebelheld area aleppo russian foreign minister sergey lavrov said security council meeting wednesday unacceptable provocation september 19 shelling humanitarian convoy near aleppo said confident coincidence require analysis investigation september 19 humanitarian convoy consisting 31 truck attacked heading aleppo according red cross 20 civilian aid worker died result initial report claimed convoy targeted airstrike later said confirm convoy attackedon tuesday russian defense ministry reiterated syrian military launched airstrikes convoy russian syrian warplane did carry airstrikes humanitarian aid convoy southwest aleppo konashenkov said statement added military studied video footage convoy appeared rule airstrike took place closely studied video footage incident took place did sign ammunition having hit convoy crater vehicle chassis intact severely damaged case airstrike konashenkov said video footage demonstrates convoy caught fire strangely happened exactly time militant started largescale offensive aleppo statement konashenkov said moscow compelled disclose sensitive detail response accusation deputy national security adviser ben rhodes laid blame attack aid convoy russia type drone monitor situation guide ground weapon target inflict surgical airstrikes object located ground itself russian spokesman explained read rtread syria news at 21st century wire syria file
3484,russian military coalition predator drone spotted time place syria aid convoy attack21st century wire say despite proclamation official detail attack aid convoy yesterday sketchy evidence hand john kerry unnamed official claim know russian attacked aid convoy passing rebel terroristheld highway travelling west aleppo heading southwest alfoua kefraya village onset russian syrian military stated involved incident maintain guilty party john kerry blaming russia mysterious attack convoythe insistence blame russia attacking aid convoy appears desperate deflectanddivert public relation mask fact washington destroyed ceasefire agreement saturday massacred 70 syrian army soldier wounding 100 sustained hourlong attack involving multiple aircraft u uk australia denmark usled airstrike isi allowed advance immediately forward taking key strategic city deir alzour spite unlikely coincidence washington claimed just mistake addition coalition gulfbacked rebel terrorist broke russiaus ceasefire multiple time record boasting earlier week terroristheld east aleppo militant refuse aid convoy crossed sightsdid rebel force ground orchestrate false flag event designed avoid condemnation saturday s massacre western colleages putting best effort hype situation blur tragedy deir ezzor distract international community alnusra s advance aleppo cover incompetence distinguishing moderate opposition terrorist syria russian spokepersonnow new evidence suggests coalition misleading world true intention rtthe russian defense ministry say coalition drone vicinity humanitarian convoy attacked outside aleppo according russian military unmanned aircraft predator drone evening september 19 specific region drone belonging international condition taken incirlik air base turkey flying height 3600 meter traveling 200 kilometer hour said russian defense ministry spokesman igor konashenkov object area town urm alkubra convoy minute caught fire konashenkov added left 30 minute defense ministry spokesman said wanted point that case tragedy september 17 saw usled coalition airstrike kill injure 200 people russian making unfounded allegation owner know exactly drone doing particular area exact time addedmoscow say provided data posse regarding attack convoy carrying aid rebelheld area aleppo russian foreign minister sergey lavrov said security council meeting wednesday unacceptable provocation september 19 shelling humanitarian convoy near aleppo said confident coincidence require analysis investigation september 19 humanitarian convoy consisting 31 truck attacked heading aleppo according red cross 20 civilian aid worker died result initial report claimed convoy targeted airstrike later said confirm convoy attackedon tuesday russian defense ministry reiterated syrian military launched airstrikes convoy russian syrian warplane did carry airstrikes humanitarian aid convoy southwest aleppo konashenkov said statement added military studied video footage convoy appeared rule airstrike took place closely studied video footage incident took place did sign ammunition having hit convoy crater vehicle chassis intact severely damaged case airstrike konashenkov said video footage demonstrates convoy caught fire strangely happened exactly time militant started largescale offensive aleppo statement konashenkov said moscow compelled disclose sensitive detail response accusation deputy national security adviser ben rhodes laid blame attack aid convoy russia type drone monitor situation guide ground weapon target inflict surgical airstrikes object located ground itself russian spokesman explained read rtread syria news at 21st century wire syria file
