,content
3189,trumpdom curious world trump foreign policy explainedniraj srivastava 21st century wireit barely seven week donald trump 45th president united state early figure detail america s foreign policy presidency however broad contour policy taking shape provide pointer likely yearsthese pointer based partly trump said election campaign partly happened president actually quite lot happened seven week so including considerable turbulence domestic foreign policybefore proceeding further useful recall trump s victory nov 2016 election unexpected opinion poll mainstream medium msm predicted victory hillary clinton candidate establishment deep state d includes militaryindustrial complex intelligence agency msm wall street jewish lobbythe d permanent unelected group institution lobby individual wields enormous power scene continues irrespective president party control congress driven quest money power thingsthe present d began taking shape thirtyfive year ago jimmy carter president d too going 1950s came existence second world war however powerful entrenched present one john f kennedy tried defy did succeed believe paid lifethe collapse soviet union 1991 speeded consolidation current d restrain military power u america liked 1990s witnessed emergence group individual known neoconservative neocon believed using american military global domination irrespective international law institution unthe military adventure neocon illegal nato bombing yugoslavia 1999 carried approval resulted disintegration country russia weak counter militarily having gotten away it nato embarked series war year aimed regime change country leader alliesthus nato ally invaded iraq 2003 overthrow saddam hussain bombed libya killed qaddafi 2011 intervened syria 2011 oust president bashar alassad effected regime change ukraine 2014 currently involved destructive war yemen saudi arabiathe continuously war year war continuing end sight estimated lost 5000 soldier spent u seven trillion fight war ten thousand soldier injured straining social economic fabric countrybut war greatly benefited element deep state enormous amount money selling weapon material needed fight war follow money useful dictum identify element continuous warfare way life sustain that powerful enemy requiredit russia come in putin came power 1999 russia slowly steadily nursed economy military health russia s resurgence upset neocon member d gotten used unfettered use american military invade country overthrow regime mentioned aboveit coincidence russia putin personally strongly demonized d presidential campaign 2016 russia accused type subversion including hacking democratic national committee email hacking election themselves supporting trump hillary clinton s campaign theme trump russian agentwhat noteworthy shred credible evidence provided clinton d support allegation provided included fake news unsubstantiated dossier rumour failed impress voter trump won election comfortable marginbut matter did end there humiliated defeat candidate hillary clinton election d launched campaign undermine trump s presidency promoting russophobia portraying russia putin threat securityit necessary provide background order interpret trump s foreign policy move took president policy relating major country issue analyzedrussiafirst trump s approach russia election campaign trump repeatedly said work normalize relation russia implied russia enemy u partner solution problem certain countriesin particular trump said russia jointly fight isi terrorist group syria suggested president assad fighting isi syria dislodging him regime change prioritytrump s attitude moscow flew face hillary clinton d saying long time russia enemy deterred overwhelming military power trump s detractor therefore accept russia policy make sure did abandon hard line moscowthey did targeting gen michael flynn trump s national security advisor nsa 9th feb washington post carried story claiming flynn spoken phone russian ambassador trump s inauguration discussed sanction russia him claimed flynn lied conversation vice president penceunder intense medium congressional pressure trump asked flynn resign did 13th feb deep state claimed victim shown trump deviated russia policy flynn violated law compromise security resign trump stand d buckled pressurebut end matter 2nd march washington post carried story stating trump s attorney general jeff session spoken twice russian ambassador 2016 session senator failed disclose confirmation hearingsthis time trump defended session said wrong true trump went offensive stating really important issue illegal leaking secret information intelligence agency medium asked fbi investigate trump alleged 4th march president obama ordered wiretapping phone trump tower ahead 2016 electionafter attack flynn trump realized final target d trump himself flynn s removal opening salvo attack jeff session second trump reluctantly accepted fall line agenda d russia syria ukraine issue otherwise d try remove impeachment charge treason conspiring enemy statetrump s changed approach russia reflected appointment feb 20 general hr mcmaster nsa place flynn mcmaster see russia hostile revisionist power doe support normalization relation country appointment mcmaster widely seen attempt trump placate enemy deep state reflects apprehension doe bidding d end like flynntrump proposed increase pentagon s budget percent amounting u 54 billion equal eighty percent russia s entire military budget 2015 expenditure defense time russia figure speak context russia s purported threat usit is therefore safe predict trump abandon objective normalize relation russia public depict russia threat security act accordingly thus recent past troop deployed poland bulgaria romania nato troop sent baltic state russia s periphery white house asked russia hand crimea ukraine chinasecond relation china trump raised chinese hackle speaking phone taiwanese president soon elected china protested vigorously eliciting dismissive reaction trump said wrong receiving congratulatory phone taiwanese president china saw trump s action undermining s china policyduring confirmation hearing secretary state tillerson said china s activity south china sea acceptable u respond china violates international law area pleased chinesehowever recent past trump climbed reaffirming s china policy avoided making statement annoy chinese grasped china s importance globally massive economic stake countrynevertheless surprising uschina relation witness turbulence trump s tenure office china designated enemy deep state help increase pentagon s budget number enemy better dsmexicothird mexico trump repeatedly promised election campaign build wall usmexico border reduce illegal immigration country s more said ask mexico pay wall issue raised nafta which according him hurting economy needed scrappedafter assuming power trump continued repeat said usmexico wall angered mexican president cancelled scheduled visit endjanuary 2017 that trump sent secretary state tillerson secretary homeland security john kelly mexico 23rd feb damage control normalization relation safe say however usmexico relation trump continue witness turbulence trump wall naftaisraelfourth israel approach country trump proving proisrael hillary clinton candidate jewish lobby u trump s israel policy driven soninlaw jared kushner orthodox jew wife ivanka trump s daughter converted judaism marrying kushner election campaign trump said embassy israel tel aviv jerusalemisraeli prime minister benjamin netanyahu visited washington midfeb 2017 meet trump talk trump said accept israeli palestinian decided onestate solution palestinian issue significant departure official position issue twostate solution based landforpeace formulaby adopting position trump effectively washed hand israelipalestinian issue leaving israeli liked abandoning palestinian fate sent team official israel examine feasibility shifting embassy tel aviv jerusalem promised himit likely presidency trump allow israel wish region especially regarding palestinian syria iran good regional securityiranfifth iran election campaign trump repeatedly expressed antiiran feeling criticized iran nuclear deal engineered obama 6th march trump imposed 90day ban travel iranian national thing stand safe say presidency usiran relation come strain approach iran affect policy syriasyriasixth syria president trump spoken setting safe zone syria obama resisted did want greater direct military involvement country trump said syrian refugee stay safe zone syria migrating europe americaif trump insists setting safe zone syria significant number troop deployed country addition hundred special force present seven base northern eastern syria increase chance deliberate inadvertent confrontation russian force present countryeuropean unionseventh european union trump taken step reassure eu commitment nato remains strong insists nato member contribute cent gdp nato s budget able enforce remains seen trump relation eu unlikely close warm obama s presidency secret eu member happier hillary clinton electedimmigrationeighth immigration trump linked policy immigration prevention terrorism u 6th march trump signed executive order banning travel 90 day national muslimmajority country iran libya syria somalia sudan yemen ironically responsible launching war destabilizing country libya syria yemen travel ban country hypocritical unjustinternational trade globalizationninth international trade globalization trump promised implement america policy clash globalization free trade soon taking over scrapped transpacific partnership tpp blamed nafta migration manufacturing job mexico trump s priority tenure fulfill promise bringing manufacturing job america if process free trade globalization undermined itindiafinally usindia relation campaigning trump spoke positively india indian diaspora u particularly hindu community group organized fundraiser trump quoted saying big fan hindu india trump administration going better friend fact say going best friend won t relationship important u trump phoned indian prime minister modi day swornin president described india true friend partner addressing challenge world however trump s protectionist approach trade pose problem india particularly regarding h1b visa used indian software company send technical personnel job u possible trump reduce number visa impose stringent rule obtain them india conveyed concern various channel wait trump finally doe clear high priority relation indiathis trump s foreign policy look moment early day thing play differently time tell actually happensniraj srivastava ambassador india served country including syria libya saudi arabia united statesread trump news at 21st century wire trump filesread syria news at 21st century wire syria filessupport 21wire subscribe member 21wiretv
3198,trump halt travel new executive order21st century wire say president donald j trump s previous visa suspension blocked federal court fulfilled vow overturn introducing new executive order temporarily blocking travel resident muslimmajority country pending revision visa procedure order halt issuance new visa citizen iran libya syria somalia sudan yemen 90 daysthe new executive order revealed reporter today secretary state rex tillerson homeland security secretary john kelly attorney general jeff session increased cooperation baghdad government background check applicant iraq excluded ordermore report russia today rt president donald trump issued new executive order temporarily blocking travel resident muslimmajority country pending revision visa procedure previous travel ban issued january blocked federal courtssecretary state rex tillerson homeland security secretary john kelly attorney general jeff session announced new executive order reporter mondaythe order halt issuance new visa citizen iran libya syria somalia sudan yemen 90 daysiraq included january ban left list time government baghdad agreed increase cooperation background check citizen applying visa ap reportediraqi foreign ministry spokesman ahmed jamal called decision important step right direction consolidates strategic alliance baghdad washington field forefront war terrorism tillerson thanked government baghdad working state department improving vetting called order vital measure protecting national security new order imposes 120day halt refugee admission country legal permanent resident green card holder country affected however reuters reported citing fact sheet supplied administration executive order affect existing lawful permanent resident kelly said adding homeland security enforce humanely respectfully professionalism trump s senior aide kellyanne conway provided confirmation interview fox news monday travel doc actually visa legal permanent resident covered particular executive action conway said adding new order effect march 16 continue report rt read trump at 21st century wire trump filessupport work subscribing member 21wiretv
3198,trump halt travel new executive order21st century wire say president donald j trump s previous visa suspension blocked federal court fulfilled vow overturn introducing new executive order temporarily blocking travel resident muslimmajority country pending revision visa procedure order halt issuance new visa citizen iran libya syria somalia sudan yemen 90 daysthe new executive order revealed reporter today secretary state rex tillerson homeland security secretary john kelly attorney general jeff session increased cooperation baghdad government background check applicant iraq excluded ordermore report russia today rt president donald trump issued new executive order temporarily blocking travel resident muslimmajority country pending revision visa procedure previous travel ban issued january blocked federal courtssecretary state rex tillerson homeland security secretary john kelly attorney general jeff session announced new executive order reporter mondaythe order halt issuance new visa citizen iran libya syria somalia sudan yemen 90 daysiraq included january ban left list time government baghdad agreed increase cooperation background check citizen applying visa ap reportediraqi foreign ministry spokesman ahmed jamal called decision important step right direction consolidates strategic alliance baghdad washington field forefront war terrorism tillerson thanked government baghdad working state department improving vetting called order vital measure protecting national security new order imposes 120day halt refugee admission country legal permanent resident green card holder country affected however reuters reported citing fact sheet supplied administration executive order affect existing lawful permanent resident kelly said adding homeland security enforce humanely respectfully professionalism trump s senior aide kellyanne conway provided confirmation interview fox news monday travel doc actually visa legal permanent resident covered particular executive action conway said adding new order effect march 16 continue report rt read trump at 21st century wire trump filessupport work subscribing member 21wiretv
3216,changing face mainstream media21st century wire say biggest trend running election season migration element fringe politics center mainstreamonly short month ago breitbart news fowas classed element far rightwing medium spectrum vanguard alt right occupying row west wing alongside press stalwart like cnn wall street journal reuters time magazinethe following photo taken preparation hour president donald trump s news conference held east room white house washington dc yesterdaytimes changing haha breitbart row pictwittercomibgado1itn rockprincess rockprincess818 february 15 2017see also fringe center fakenews context leftright dialecticsread msm news at 21st century msm watch file
3216,changing face mainstream media21st century wire say biggest trend running election season migration element fringe politics center mainstreamonly short month ago breitbart news fowas classed element far rightwing medium spectrum vanguard alt right occupying row west wing alongside press stalwart like cnn wall street journal reuters time magazinethe following photo taken preparation hour president donald trump s news conference held east room white house washington dc yesterdaytimes changing haha breitbart row pictwittercomibgado1itn rockprincess rockprincess818 february 15 2017see also fringe center fakenews context leftright dialecticsread msm news at 21st century msm watch file
3226,twothirds navy strike fighter jet grounded navy claim money fix them21st century wire say defense news said sixtytwo percent navy s f18s grounded service attributed be isn t money fix noted awaiting planned maintenance held waiting spare part wonder story navy s fighter commission dod budget 2016 600 billion dollar money spare part rt breaking story further ll factor consider just money spare part factor including shore facility disrepair refurbishretrofit issue new equipment delay development replacement platform f35 compounded decade war rtsixtytwo percent navy s fa18s service 27 percent major depot work 35 percent simply awaiting maintenance part defense news said adding 53 percent navy aircraft 1700 combat aircraft patrol transport plane helicopter t flymoreover isn t money fix fleet s ship backlog ship needing work continues grow article say sub allegedly service literally year year more defense news reportsthe navy t money service member family change assignment 440 million needed pay sailor according publication service claim 15 percent shore facility failed condition awaiting repair replacement demolition addedaccording john venable senior research fellow defense policy heritage foundation backlog huge ll year refit refurbish repair f18s unserviceable condition t catch trump administration gave money need told washington free beacon variety reason shipyard aviation depot struggling ship airplane maintenance period time vice chief naval operation admiral william moran told lawmaker house armed service committee wednesdayread more defense secretary mattis order review f35 air force cut cost clear navy s overall readiness reached lowest level year noted adding problem causing situation funding reduction consistent uncertainty reduced budget approved 2001 2015 navy able average 100 ship sea day moran said adding navy smaller today s 99 year budget cap imposed military nonmilitary spending budget control act degraded military readiness representative adam smith dwashington told cnn adding factor constraint compounded decade war continue report rtsupport work subscribing member 21wiretv
3226,twothirds navy strike fighter jet grounded navy claim money fix them21st century wire say defense news said sixtytwo percent navy s f18s grounded service attributed be isn t money fix noted awaiting planned maintenance held waiting spare part wonder story navy s fighter commission dod budget 2016 600 billion dollar money spare part rt breaking story further ll factor consider just money spare part factor including shore facility disrepair refurbishretrofit issue new equipment delay development replacement platform f35 compounded decade war rtsixtytwo percent navy s fa18s service 27 percent major depot work 35 percent simply awaiting maintenance part defense news said adding 53 percent navy aircraft 1700 combat aircraft patrol transport plane helicopter t flymoreover isn t money fix fleet s ship backlog ship needing work continues grow article say sub allegedly service literally year year more defense news reportsthe navy t money service member family change assignment 440 million needed pay sailor according publication service claim 15 percent shore facility failed condition awaiting repair replacement demolition addedaccording john venable senior research fellow defense policy heritage foundation backlog huge ll year refit refurbish repair f18s unserviceable condition t catch trump administration gave money need told washington free beacon variety reason shipyard aviation depot struggling ship airplane maintenance period time vice chief naval operation admiral william moran told lawmaker house armed service committee wednesdayread more defense secretary mattis order review f35 air force cut cost clear navy s overall readiness reached lowest level year noted adding problem causing situation funding reduction consistent uncertainty reduced budget approved 2001 2015 navy able average 100 ship sea day moran said adding navy smaller today s 99 year budget cap imposed military nonmilitary spending budget control act degraded military readiness representative adam smith dwashington told cnn adding factor constraint compounded decade war continue report rtsupport work subscribing member 21wiretv
3240,uber google twitter netflix tech giant file unlawful immigration retort trump21st century wire say group silicon valley tech company filed rare legal brief stating trump administration s executive order immigration discriminatory departs dramatically principle governed immigration law decade legal filing follows report friday federal judge issued temporarily restraining order blocking border patrol custom immigration service enforcing president trump s recent executive order bar entry u coming seven majority muslim countriesthis story leaked text legal challenge washington post exclusive sunday elizabeth dwoskin washington postsilicon valley stepping confrontation trump administrationon sunday night google facebook uber twitter netflix prominent tech company planning file legal brief opposing administration s contentious entry ban according people familiar matterthe amicus brief expected filed u court appeal 9th circuit expected rule day appeal administration federal judge seattle issued late friday temporary restraining order putting entry ban hold brief come end week nationwide protest plan flurry activity silicon valley region see immigration central identity innovation hubcompanies backing filing include pinterest yelp square reddit kickstarter github glassdoor box mozilla dropbox twilio zynga medium pinterest salesforce according source spoke condition anonymity filing finalized sundaynotably doesn t appear apple amazon microsoft party brief source cautioned wording brief participant change filing sunday nighta draft filing say entry ban barred individual seven majoritymuslim country entering u 90 day suspended u refugee program discriminatory order effect sudden seismic shift rule governing entry united state departs dramatically principle governed immigration law decade draft obtained washington post read order discriminates basis national origin religion close border world s vulnerable people fleeing devastation war establishes discretionary arbitrary rule admission country immigrant lived lawfully year continue story washington postread immigration ban news at 21st century wire immigration file
3240,uber google twitter netflix tech giant file unlawful immigration retort trump21st century wire say group silicon valley tech company filed rare legal brief stating trump administration s executive order immigration discriminatory departs dramatically principle governed immigration law decade legal filing follows report friday federal judge issued temporarily restraining order blocking border patrol custom immigration service enforcing president trump s recent executive order bar entry u coming seven majority muslim countriesthis story leaked text legal challenge washington post exclusive sunday elizabeth dwoskin washington postsilicon valley stepping confrontation trump administrationon sunday night google facebook uber twitter netflix prominent tech company planning file legal brief opposing administration s contentious entry ban according people familiar matterthe amicus brief expected filed u court appeal 9th circuit expected rule day appeal administration federal judge seattle issued late friday temporary restraining order putting entry ban hold brief come end week nationwide protest plan flurry activity silicon valley region see immigration central identity innovation hubcompanies backing filing include pinterest yelp square reddit kickstarter github glassdoor box mozilla dropbox twilio zynga medium pinterest salesforce according source spoke condition anonymity filing finalized sundaynotably doesn t appear apple amazon microsoft party brief source cautioned wording brief participant change filing sunday nighta draft filing say entry ban barred individual seven majoritymuslim country entering u 90 day suspended u refugee program discriminatory order effect sudden seismic shift rule governing entry united state departs dramatically principle governed immigration law decade draft obtained washington post read order discriminates basis national origin religion close border world s vulnerable people fleeing devastation war establishes discretionary arbitrary rule admission country immigrant lived lawfully year continue story washington postread immigration ban news at 21st century wire immigration file
